headline,url,publisher,date,stock
"Apple leads pre-market gains","https://newsroom.example.com/aapl-pre","TechWire","2025-11-19T08:15:00-04:00","AAPL"
"Tesla trims prices in Europe","https://finance.example.com/tsla-eu","MarketDaily","2025-11-19T13:40:00-04:00","TSLA"
"Amazon invests in green data centers","https://finance.example.com/amzn-green","EcoFin","2025-11-20T09:05:00-04:00","AMZN"
"Apple faces supply delays","https://news.example.com/aapl-delay","GlobalBiz","2025-11-20T16:45:00-04:00","AAPL"
"Fed hints at slower hikes","https://macro.example.com/fed-hike","MacroBeat","2025-11-21T07:30:00-04:00","SPY"
"Tesla beats delivery goal","https://auto.example.com/tsla-delivery","AutoEdge","2025-11-21T10:10:00-04:00","TSLA"
